{
    "name": "aggressive",
    "risk_level": "aggressive",
    "auto_approve_threshold_usd": 1000,
    "require_human_review": [
        "deploy"
    ],
    "allowed_actions_without_approval": [
        "read",
        "summarize",
        "query",
        "write",
        "delete",
        "create",
        "update"
    ],
    "escalation_channel": "slack:#ops-alerts",
    "max_concurrent_auto_actions": 20,
    "created_at": "2026-02-16T05:00:00Z",
    "created_by": "system"
}